{
  "$schema": "https://json-schema.org/draft/2020-12/schema",
  "$id": "https://github.com/3se-framework/3se-glossary/schemas/bibo-reference.schema.json",
  "title": "Glossary Bibliographic Resource",
  "description": "Represents a bibo:Document (or subclass) — a bibliographic resource as defined by the Bibliographic Ontology (BIBO, http://purl.org/ontology/bibo/). All properties are derived from BIBO, Dublin Core Terms, FOAF, and PRISM where specified. Expressed as a JSON-LD-ready document.",
  "type": "object",
  "additionalProperties": false,
  "required": [
    "@type",
    "title"
  ],
  "properties": {
    "@context": {
      "type": "string",
      "format": "uri",
      "const": "https://github.com/3se-framework/3se-glossary/contexts/reference.context.jsonld",
      "description": "JSON-LD context URI. Must reference the canonical context document for this schema."
    },
    "@id": {
      "type": "string",
      "format": "uri",
      "description": "The globally unique IRI identifying this bibliographic resource as an RDF subject. Should be a DOI URI (https://doi.org/…) when available, otherwise a stable canonical URL or a local IRI."
    },
    "@type": {
      "description": "RDF type(s) drawn from the BIBO class hierarchy. Must be a subclass of bibo:Document. Multiple types may be combined (e.g. ['bibo:Article', 'bibo:AcademicArticle']). See $defs/biboTypes for the full enumeration.",
      "oneOf": [
        {
          "$ref": "#/$defs/biboType"
        },
        {
          "type": "array",
          "items": {
            "$ref": "#/$defs/biboType"
          },
          "minItems": 1,
          "uniqueItems": true
        }
      ]
    },
    "title": {
      "description": "dcterms:title — The full, official title of the bibliographic resource.",
      "oneOf": [
        {
          "type": "string",
          "minLength": 1
        },
        {
          "$ref": "#/$defs/langStringMap"
        }
      ]
    },
    "subtitle": {
      "description": "bibo:shortTitle / dcterms:alternative — Subtitle or alternative title of the resource.",
      "oneOf": [
        {
          "type": "string"
        },
        {
          "$ref": "#/$defs/langStringMap"
        }
      ]
    },
    "abstract": {
      "description": "bibo:abstract — A summary of the resource. Maps to bibo:abstract (and schema:abstract).",
      "oneOf": [
        {
          "type": "string"
        },
        {
          "$ref": "#/$defs/langStringMap"
        }
      ]
    },
    "authorList": {
      "description": "bibo:authorList — Ordered list of authors as foaf:Agent nodes. Order is significant and preserved via JSON-LD @list. Use this instead of (or in addition to) 'creator' when authorship order must be recorded.",
      "type": "array",
      "items": {
        "$ref": "#/$defs/agent"
      },
      "minItems": 1
    },
    "editorList": {
      "description": "bibo:editorList — Ordered list of editors as foaf:Agent nodes. Relevant for edited volumes, proceedings, etc.",
      "type": "array",
      "items": {
        "$ref": "#/$defs/agent"
      }
    },
    "publisher": {
      "description": "dcterms:publisher — The entity responsible for making the resource available (publisher, issuing body, conference organisation, etc.).",
      "$ref": "#/$defs/agentOrString"
    },
    "date": {
      "description": "dcterms:date — Date of publication. Prefer ISO 8601 formats: full date (YYYY-MM-DD), year-month (YYYY-MM), or year only (YYYY).",
      "type": "string",
      "pattern": "^[0-9]{4}(-[0-9]{2}(-[0-9]{2})?)?$"
    },
    "issued": {
      "description": "dcterms:issued — Date of formal issuance or publication. More specific than dcterms:date; preferred for standards and RFCs.",
      "type": "string",
      "pattern": "^[0-9]{4}(-[0-9]{2}(-[0-9]{2})?)?$"
    },
    "modified": {
      "description": "dcterms:modified — Date of last significant revision of the resource itself.",
      "type": "string",
      "format": "date"
    },
    "identifier": {
      "description": "dcterms:identifier — Generic identifier (e.g. local call number, arxiv ID). Prefer the typed identifiers (doi, isbn13, issn, etc.) whenever possible.",
      "oneOf": [
        {
          "type": "string"
        },
        {
          "type": "array",
          "items": {
            "type": "string"
          },
          "uniqueItems": true
        }
      ]
    },
    "doi": {
      "description": "bibo:doi — Digital Object Identifier, without the 'doi:' prefix (e.g. '10.1000/xyz123'). The canonical IRI form (https://doi.org/…) should be used as @id when possible.",
      "type": "string",
      "pattern": "^10\\.\\d{4,}(\\.[0-9]+)*/\\S+$"
    },
    "uri": {
      "description": "bibo:uri — Canonical URI of the resource.",
      "type": "string",
      "format": "uri"
    },
    "url": {
      "description": "schema:url — A URL where the resource or a representation of it can be accessed. Less stable than bibo:uri or doi.",
      "type": "string",
      "format": "uri"
    },
    "isbn10": {
      "description": "bibo:isbn10 — 10-digit ISBN identifier (digits and optional hyphens).",
      "type": "string",
      "pattern": "^[0-9]{1,5}-[0-9]+-[0-9]+-[0-9X]$|^[0-9]{9}[0-9X]$"
    },
    "isbn13": {
      "description": "bibo:isbn13 — 13-digit ISBN identifier (digits and optional hyphens, must start with 978 or 979).",
      "type": "string",
      "pattern": "^97[89]-?[0-9]{1,5}-?[0-9]+-?[0-9]+-?[0-9]$|^97[89][0-9]{10}$"
    },
    "issn": {
      "description": "bibo:issn — ISSN of the journal, series, or periodical in which the resource was published.",
      "type": "string",
      "pattern": "^[0-9]{4}-[0-9]{3}[0-9X]$"
    },
    "eissn": {
      "description": "bibo:eissn — Electronic ISSN of the publication venue.",
      "type": "string",
      "pattern": "^[0-9]{4}-[0-9]{3}[0-9X]$"
    },
    "number": {
      "description": "bibo:number — Generic document or technical report number (e.g. RFC 9110, W3C REC, NIST SP 800-53).",
      "type": "string"
    },
    "edition": {
      "description": "bibo:edition — Edition statement (e.g. '3rd', '2nd revised').",
      "type": "string"
    },
    "volume": {
      "description": "bibo:volume — Volume number of the journal or multi-volume work.",
      "type": "string"
    },
    "issue": {
      "description": "bibo:issue — Issue number of the journal.",
      "type": "string"
    },
    "pageStart": {
      "description": "bibo:pageStart — Starting page of the article within a journal, proceedings, or collection.",
      "type": [
        "string",
        "integer"
      ]
    },
    "pageEnd": {
      "description": "bibo:pageEnd — Ending page of the article within a journal, proceedings, or collection.",
      "type": [
        "string",
        "integer"
      ]
    },
    "numPages": {
      "description": "bibo:numPages — Total number of pages in the resource.",
      "type": "integer",
      "minimum": 1
    },
    "chapter": {
      "description": "bibo:chapter — Chapter number, if the resource is a chapter within a book.",
      "type": [
        "string",
        "integer"
      ]
    },
    "section": {
      "description": "bibo:section — Section identifier within the resource.",
      "type": "string"
    },
    "isPartOf": {
      "description": "dcterms:isPartOf — The containing resource (e.g. the journal, proceedings, or book in which this article appears). Expressed as a URI or an inline bibo:Document object.",
      "$ref": "#/$defs/documentRef"
    },
    "hasPart": {
      "description": "dcterms:hasPart — Components of this resource (e.g. chapters, sections, supplementary materials).",
      "type": "array",
      "items": {
        "$ref": "#/$defs/documentRef"
      },
      "uniqueItems": true
    },
    "cites": {
      "description": "bibo:cites — Resources that are cited by this resource.",
      "type": "array",
      "items": {
        "$ref": "#/$defs/documentRef"
      },
      "uniqueItems": true
    },
    "citedBy": {
      "description": "Inverse of bibo:cites — Resources that cite this resource (denormalised, for convenience).",
      "type": "array",
      "items": {
        "$ref": "#/$defs/documentRef"
      },
      "uniqueItems": true
    },
    "subject": {
      "description": "dcterms:subject — The topic of the resource, expressed as IRIs (e.g. skos:Concept IRIs) or plain-text keywords.",
      "type": "array",
      "items": {
        "oneOf": [
          {
            "type": "string",
            "format": "uri",
            "description": "IRI of a concept (e.g. a skos:Concept)."
          },
          {
            "type": "string",
            "description": "Plain-text keyword."
          }
        ]
      },
      "uniqueItems": true
    },
    "language": {
      "description": "dcterms:language — BCP 47 language tag(s) of the resource (e.g. 'en', 'fr', 'en-US').",
      "oneOf": [
        {
          "type": "string",
          "pattern": "^[a-z]{2,3}(-[A-Za-z0-9]{2,8})*$"
        },
        {
          "type": "array",
          "items": {
            "type": "string",
            "pattern": "^[a-z]{2,3}(-[A-Za-z0-9]{2,8})*$"
          },
          "uniqueItems": true
        }
      ]
    },
    "rights": {
      "description": "dcterms:rights — A statement about rights held over the resource.",
      "type": "string"
    },
    "license": {
      "description": "dcterms:license — IRI of the license under which the resource is distributed (e.g. 'https://creativecommons.org/licenses/by/4.0/').",
      "type": "string",
      "format": "uri"
    },
    "status": {
      "description": "bibo:status — Publication or editorial status of the resource. Expressed as a CURIE from the BIBO status vocabulary or a plain string.",
      "type": "string",
      "enum": [
        "bibo:draft",
        "bibo:forthcoming",
        "bibo:peerReviewed",
        "bibo:published",
        "bibo:rejected",
        "bibo:unpublished"
      ]
    },
    "entryCreated": {
      "type": "string",
      "format": "date",
      "description": "dcterms:created — ISO 8601 date on which this glossary entry was first created."
    },
    "entryModified": {
      "type": "string",
      "format": "date",
      "description": "dcterms:modified — ISO 8601 date on which this glossary entry was last modified."
    },
    "entryCreator": {
      "description": "dcterms:creator — Agent(s) who originally created this glossary entry.",
      "$ref": "#/$defs/agentOrList"
    },
    "entryContributor": {
      "description": "dcterms:contributor — Agent(s) who contributed to this glossary entry after its initial creation.",
      "$ref": "#/$defs/agentOrList"
    }
  },
  "$defs": {
    "biboType": {
      "description": "A BIBO document class CURIE. All are subclasses of bibo:Document.",
      "type": "string",
      "enum": [
        "bibo:Document",
        "bibo:Article",
        "bibo:AcademicArticle",
        "bibo:Book",
        "bibo:BookSection",
        "bibo:Chapter",
        "bibo:EditedBook",
        "bibo:MultiVolumeBook",
        "bibo:Proceedings",
        "bibo:Conference",
        "bibo:Report",
        "bibo:TechnicalDocument",
        "bibo:Thesis",
        "bibo:Manuscript",
        "bibo:Note",
        "bibo:Patent",
        "bibo:Standard",
        "bibo:Statute",
        "bibo:LegalDocument",
        "bibo:LegalCaseDocument",
        "bibo:Legislation",
        "bibo:ReferenceSource",
        "bibo:Webpage",
        "bibo:Website",
        "bibo:AudioDocument",
        "bibo:AudioVisualDocument",
        "bibo:Image",
        "bibo:Map",
        "bibo:Slideshow",
        "bibo:CollectedDocument",
        "bibo:Collection",
        "bibo:Journal",
        "bibo:Series",
        "bibo:Periodical",
        "bibo:Issue",
        "bibo:Newspaper"
      ]
    },
    "langStringMap": {
      "type": "object",
      "description": "A map of BCP 47 language tag to a natural-language string value.",
      "minProperties": 1,
      "propertyNames": {
        "pattern": "^[a-z]{2,3}(-[A-Za-z0-9]{2,8})*$"
      },
      "additionalProperties": {
        "type": "string",
        "minLength": 1
      }
    },
    "agent": {
      "description": "A foaf:Agent — a person, organisation, or software agent.",
      "oneOf": [
        {
          "type": "string",
          "description": "Plain-text name of the agent."
        },
        {
          "type": "object",
          "additionalProperties": false,
          "required": [
            "name"
          ],
          "properties": {
            "@id": {
              "type": "string",
              "format": "uri",
              "description": "foaf:Agent IRI (e.g. ORCID https://orcid.org/0000-0000-0000-0000, WebID, or GitHub profile URI)."
            },
            "@type": {
              "type": "string",
              "enum": [
                "foaf:Person",
                "foaf:Organization",
                "foaf:Agent"
              ],
              "default": "foaf:Person"
            },
            "name": {
              "type": "string",
              "minLength": 1,
              "description": "foaf:name — Full name or display name."
            },
            "familyName": {
              "type": "string",
              "description": "foaf:familyName — Family or last name."
            },
            "givenName": {
              "type": "string",
              "description": "foaf:givenName — Given or first name."
            },
            "mbox": {
              "type": "string",
              "format": "email",
              "description": "foaf:mbox — Email address."
            },
            "orcid": {
              "type": "string",
              "format": "uri",
              "pattern": "^https://orcid\\.org/[0-9]{4}-[0-9]{4}-[0-9]{4}-[0-9]{3}[0-9X]$",
              "description": "ORCID URI. Should match @id when the agent is identified by ORCID."
            }
          }
        }
      ]
    },
    "agentOrList": {
      "oneOf": [
        {
          "$ref": "#/$defs/agent"
        },
        {
          "type": "array",
          "items": {
            "$ref": "#/$defs/agent"
          },
          "minItems": 1,
          "uniqueItems": true
        }
      ]
    },
    "agentOrString": {
      "oneOf": [
        {
          "type": "string"
        },
        {
          "$ref": "#/$defs/agent"
        }
      ]
    },
    "documentRef": {
      "description": "A reference to another bibo:Document, as a URI or an inline stub object.",
      "oneOf": [
        {
          "type": "string",
          "format": "uri",
          "description": "IRI of the referenced document."
        },
        {
          "type": "object",
          "additionalProperties": false,
          "required": [
            "@id"
          ],
          "properties": {
            "@id": {
              "type": "string",
              "format": "uri",
              "description": "IRI of the referenced document."
            },
            "@type": {
              "$ref": "#/$defs/biboType"
            },
            "title": {
              "type": "string"
            },
            "doi": {
              "type": "string"
            }
          }
        }
      ]
    }
  }
}
